key	text	tooltip
#Loc PackedFile;1;text/db/ovn_fimir_settlement_occupation.loc		
culture_settlement_occupation_options_tooltip_225218921	Study Ruins||You will be presented with a puzzle to solve; you will be rewarded if you successfully decipher it.	false
culture_settlement_occupation_options_tooltip_225218922	Settle||Your people have a new home.	false
culture_settlement_occupation_options_tooltip_225218923	Do Nothing||Leave the settlement as it stands.	false
culture_settlement_occupation_options_tooltip_225218924	Collect Tithe & Occupy||You gain wealth from the tithe, but buildings in the settlement are damaged. All captives are converted, [[img:icon_public_order]][[/img]]{{tr:hp_campaign_public_order_term}} is greatly reduced, and your diplomatic relations with the previous owner also suffer greatly.	false
culture_settlement_occupation_options_tooltip_225218925	Cleanse with Fire||All buildings are destroyed and the settlement is torched.	false
culture_settlement_occupation_options_tooltip_225218926	Resettle||With no regions currently under your control, you have the option to settle your people here.	false
culture_settlement_occupation_options_tooltip_225218927	Demand Offerings||You do not capture the settlement but instead take offerings in the form of gold and damage buildings. All captives are converted, [[img:icon_public_order]][[/img]]{{tr:hp_campaign_public_order_term}} is reduced, and the previous owners will like you a lot less.	false
culture_settlement_occupation_options_tooltip_225218928	Purify & Settle||{{tr:occupation_decision_occupy}}	false
